{
    "$schema": "http://json-schema.org/draft-04/schema#",
    "type": "object",
    "properties": {
        "id": {
            "type": "string"
        },
        "voucherType": {
            "type": "string"
        },
        "voucherStatus": {
            "type": "string"
        },
        "voucherNumber": {
            "type": "string"
        },
        "voucherDate": {
            "type": "string",
            "format": "date-time"
        },
        "createdDate": {
            "type": "string",
            "format": "date-time"
        },
        "updatedDate": {
            "type": "string",
            "format": "date-time"
        },
        "dueDate": {
            "type": "string",
            "format": "date-time"
        },
        "contactId": {
            "type": "string"
        },
        "contactName": {
            "type": "string"
        },
        "totalAmount": {
            "type": "number"
        },
        "openAmount": {
            "type": "number"
        },
        "currency": {
            "type": "string"
        },
        "archived": {
            "type": "boolean"
        }
    },
    "required": [
        "id",
        "voucherType",
        "voucherStatus",
        "voucherNumber",
        "voucherDate",
        "createdDate",
        "updatedDate",
        "archived"
    ]
}